{
  "schemaVersion":"1.0.0","decisionId":"0198e0a1-0000-7011-8000-000000000011","outcome":"ALLOW_WITH_REQUIREMENTS","policySnapshotId":"0198e0a1-0000-7012-8000-000000000012","policySnapshotHash":"2222222222222222222222222222222222222222222222222222222222222222","inputHash":"3333333333333333333333333333333333333333333333333333333333333333","matchedRuleIds":["fixture-write-low-risk"],"hardInvariantIds":["no-model-authority","no-isolation-downgrade"],"requirements":{"permissionScopes":["workspace.write:fixture/target.txt"],"minimumIsolationLevel":"PROCESS_RESTRICTED","verificationProfileRefs":[{"subjectType":"VerificationProfile","subjectId":"fixture-change-r2","subjectVersion":"1.0.0"}],"timeoutMs":30000,"maxConcurrency":1,"postVerificationRequired":true},"reasonCodes":[],"residualRiskRefs":[{"subjectType":"Risk","subjectId":"process-restricted-not-security-sandbox","subjectVersion":"1.0.0"}],"evaluatedAt":"2026-08-26T08:10:01Z","evaluatorVersion":"1.0.0"
}
